{
  "schema_version": 1,
  "chart_version": "",
  "region": "global",
  "period": "2026-09",
  "computed_at": "2026-10-01T09:57:40Z",
  "rollup_run_id": "01a0f6e5-f4a5-7940-87a9-eada285b7ce2",
  "slos": {
    "L2_AVAILABILITY": {
      "target": 0.995,
      "achieved": null,
      "verdict": "indeterminate",
      "numerator": 0,
      "denominator": 0,
      "error_budget_consumed_pct": 0.0
    },
    "L2_LATENCY_P95": {
      "target": 0.99,
      "achieved": null,
      "verdict": "indeterminate",
      "numerator": 0,
      "denominator": 0,
      "error_budget_consumed_pct": 0.0
    },
    "REPLICATION_LAG_P99": {
      "target": 0.99,
      "achieved": null,
      "verdict": "indeterminate",
      "numerator": 0,
      "denominator": 0,
      "error_budget_consumed_pct": 0.0
    },
    "SWARM_RECOVERY_TIME": {
      "target": 0.99,
      "achieved": null,
      "verdict": "indeterminate",
      "numerator": 0,
      "denominator": 0,
      "error_budget_consumed_pct": 0.0
    }
  },
  "missing_days": [
    "2026-09-01",
    "2026-09-02",
    "2026-09-03",
    "2026-09-04",
    "2026-09-05",
    "2026-09-06",
    "2026-09-07",
    "2026-09-08",
    "2026-09-09",
    "2026-09-10",
    "2026-09-11",
    "2026-09-12",
    "2026-09-13",
    "2026-09-14",
    "2026-09-15",
    "2026-09-16",
    "2026-09-17",
    "2026-09-18",
    "2026-09-19",
    "2026-09-20",
    "2026-09-21",
    "2026-09-22",
    "2026-09-23",
    "2026-09-24",
    "2026-09-25",
    "2026-09-26",
    "2026-09-27",
    "2026-09-28",
    "2026-09-29",
    "2026-09-30"
  ],
  "stability_contract_version": "1.4"
}